name,title,star,contents,date
기초영어 회화 핵심표현 Real Speaking,연수 완전 추천,5점,실생활에 사용 가능한 영어 표현이어서 좋았습니다. 바로바로 사용할 수 있는 표현을 익힐 수 있어서 추천드립니다.,2022.10.20
세상에서 제일 쉬운 과학 이야기,배움의 단계를 넘어서다,5점,"과학에 대한 관심이 있었지만 도무지 어려운 내용들이 어지럽게 머릿속을 헤집고 다녔다면, 이 연수를 통하 한번에 정리가 되었습니다. 아이들과 함께 나누고 싶은 지식도 있었고 무엇보다 재미있는 스토리텔링처럼 쭉 이어 나가는 이야기 방식의 연수가 저는 정말 재미있었습니다!!
책도 정말 자미있었어요. 감사합니다",2022.10.20
정훈쌤의 뚝딱 칼림바,기대보다 더 좋았던 연수,5점,"이렇게 좋은 연수 만들어주셔서 감사하다는 이야기부터 하고 싶어요! 코로나가 시작되면서 악기교육을 아이들과 어떻게 시작할까 고민이 많았어요. 핸드벨? 실로폰? 그런데 지도가 쉽지 않다거나 휴대가 불편하다거나 하는 고민에 문득 집어든 요즘 유행하는 칼림바! 그런데 제가 지도를 받지 않고 악기를 시작하게 한다는 건 너무 아니다 싶어 연수를 신청했습니다. 결론은 정말 듣기 잘했다! 였어요. 유튜브를 찾아가며 독학하기 쉽지 않았는데, 이 연수를 통해 차근차근 아이들과 즐거운 음악시간 같이 보냈습니다! 연수를 아이들과 함께 들을 수 있은 멋진 연수였습니다❤️",2022.10.20
인성교육 연구보고서 작성법,인성뿐만 아니라 연구보고서 작성의 바이블이 맞다,5점,인성보고서가 전국단위로 변경되면서 바뀐 내용에 대해 헤매고 있었는데 좋은 지침이 되었습니다. 내용이 알차고 직접 평가하시는 평가 경험자가 연수를 해주시니 보고서를 쓰는 관점이 넓어져서 너무 좋습니다,2022.10.20
일본어 마스터 1,신나는 일본어 마스터,5점,"톡톡 튀는 강사님의 신나는 강의에 나도 모르게 열공, 열중 하게 됩니다. 도입부에 노래로 시작해서 긴장이 풀리게 도와줍니다. 그리고 외국어에 쉽게 접근할 수 있도록 신비의 노하우로 어느새 일본어에 다가서 있는 나를 발견합니다. 그리고 시작할 때 이전 시간의 내용을 한 번 더 상기시켜서 잊지 않게 해 줍니다. 어렵게만 느껴졌던 일본어를 할 수 있어서 행복합니다. 이제 다른 외국어에 도전할 수 있는 자신감이 생겼어요. 콘텐츠가 아주 좋다고 생각됩니다.",2022.10.20
초등학생 탐구생활,처음에는 의무로 들었지만 공감이 많이 가는 연수,5점,처음에는 학교폭력 30시간 이수하려고 들었는데 듣다보니 공감가는 내용이 너무 많았습니다. 학기초에 들었으면 더 좋았을텐데 내년에 학생생활지도할때 써먹어야겠어요,2022.10.20
과학 세상을 말하다 (과학이 필요한 시간),과학을 통해 인간의 삶과 죽음을 통찰하다.,5점,"인간이라는 존재를 과학적으로 해석하고 좀더 객관적으로 바로 보는 관점이 매우 흥미롭고 인간의 삶과 행복, 죽음에 대해 과학적으로 해석한 내용이 매우 흥미로웠습니다. 15차시 내내 지루한지 모르고 들었고 강의를 해주신 분이 책을 읽어 주시고 어려운 부분도 쉽게 해석해 주듯이 강의를 진행해 주셔서 매우 인상적이었습니다. 끝나는 것이 좀 아쉽고 반복해서 2번씩 들을 겁니다. 좋은 연수였습니다. ^^",2022.10.19
"학급경영, 수업, 업무 - 노션으로 한 방에 해결하기","노션 연수 덕분에~ 수업에도, 업무에도 제대로 차근차근 활용하고 있어요.",5점,"티셀파 연수를 둘러보다가 노션이라는 기록 정리 툴이 있다는 것을 알고, 너무 해보고 싶은데 어려울까봐 주저하는 마음 사이에서 고민하며 신청했어요. 이제라도 연수를 듣고 할 수 있게 되어 얼마나 다행인지요. 정말이지 노션 툴은 그 자체로도 편하지만 이 연수를 들으며 정말 쉽게 이해하고 따라 할 수 있었어요. 선생님들이 궁금한 것, 필요한 것을 토대로 연수가 이루어져서 필요한 것을 제대로 재밌게 들을 수 있었어요. 노션은 컴퓨터 바탕화면처럼 편리하게 쓸 수 있어 대만족했습니다. 업무하는데도 도움이 많이 될 것 같아요. 필요한 연수였고 듣는 내내 재밌게 배웠습니다~ ~ ^.^",2022.10.19
그림검사와 다양한 기법으로 만나는 미술치료,그림검사와 다양한 기법으로 만나는 미술치료,5점,"미술은 타고난 재능이 있는 사람들만의 과목이라고 생각하여 타고난 미적 감각이 있어야 즐겁게 할 수 있다고 생각하였다. 그러나 미술이란 자신을 표현하는 것이어서 마음껏 자신을 표현할 수 있는 기회를 학생들에게 주면 학생들은 창의성을 발휘하여 신나는 미술 활동을 하며 자신을 스스로 치유해나간다는 것을 배우게 되었습니다. 매주 맞이하는 미술 수업 시간이 두려웠었는데 이제 이것저것 다양한 활동 계획으로 기다려집니다. 정말 훌륭한 강의 재미있게 잘 들었고, 미술 강의를 들으며 저도 힐링이 되어 스케치북을 펴고 그림을 그리고 싶어지는 미술 수업 강의입니다. 저처럼 보다 풍성한 미술 수업을 원하시는 선생님들께 강추합니다. 감사합니다.^^",2022.10.18
지리와 함께하는 인문학 티타임,새로운 삶의 지혜를 눈뜨게 해준 귀한 시간,5점,개인적으로 공간지각력이 뛰어난 편인데 아마도 고등학교 시절 지리를 좋아하던 것이 원인이 아닐까 생각합니다. 매일 산책을 하면서 스쳐지나가던 우리 동네 길들이 새롭게 느껴지는 것도 샘과 함께 한 연수 덕분인 것 같습니다. 더불어 아이들과 함께 나누던 이야기도 다른 시각으로 볼 수 있는 눈을 열어준 귀한 시간이었습니다. 이 시간 이후 제가 걷고 있는 앞으로 걸을 길들과 자연들을 더 세심하게 살피고 생각할 수 있을 것 같습니다. 좋은 강의 감사합니다. 주신 책도 다시 한번 정독하며 사색하고 다른 이들과 함께 나눠보겠습니다.,2022.10.18
손그림과 파워포인트로 교실 속 콘텐츠 만들기,손그림 힘! 대단해요~,5점,"손그림과 파워포인트로 만든 콘텐츠가 학생들의 흥미를 유발하는데 아주 좋아요. 강추합니다.~~~
선생님이 직접 그림을 보여주면서 배움을 실천하니 학생들도 더 집중하여 수업에 임합니다. 또 학생들 스스로 그림을 그려보면서 학습 내용을 정리하니 이해력도 높아집니다.
손그림과 파워포인트로 동기유발도 할 수 있고 단원정리할 때도 유용합니다. 특히 손그림으로 주요 내용을 정리하는 방법을 터득한 학생들이 스스로 공부를 하는 마술이 일어나네요~",2022.10.18
"학급경영, 수업, 업무 - 노션으로 한 방에 해결하기",유익한 연수,5점,노션이라는 새로운 워크스페이스를 알게 되어 매우 유익한 연수였습니다. 복잡한 내용을 실제 교직생활에 맞는 부분만을 쉽게 자세히 설명해 주셔서 매우 유익햇습니다.,2022.10.18
"나이와 신분을 초월한 독립운동, 그 현장을 읽다",나이와 신분도 잊고 독립운동의 현장 한가운데 있었다.,4점,"잘 몰랐던, 그러나 우리 독립운동사에서 소중한 독립운동가들을 많이 알게 돼서 너무 좋다. 앞으로도 더 많은 독립운동가들의 활약상을 발굴하여 일반 대중과 교사, 어린이들에게도 계속 알려줬으면 좋겠다.",2022.10.17
"학급경영, 수업, 업무 - 노션으로 한 방에 해결하기",굉장히 유용했어요.,5점,"구글만 알고 있다가 노션을 처음 알게 되었는데
정말 다양하게 연동되고 편리하게 쓸 수 있네요ㅎㅎ
차분하게 알려주셔서 쉽게 잘 배웠습니다.",2022.10.17
"나이와 신분을 초월한 독립운동, 그 현장을 읽다",좋은 연수 감사합니다.,4점,독립운동에 대한 전반적인 개괄을 하면서도 세부적인 지식을 쌓아 학생 지도에 도움을 많이 받았습니다. 좋은 연수를 무료로 참가할 수 있도록 기회를 마련해 주셔서 감사합니다.,2022.10.17
7인의 전문의와 함께하는 메디컬 콘서트,유익한 시간이었어요,5점,"다양한 질병에 대한 원인과 대처법을 통해 제 자신의 건강은 물론이고 가족, 특히 청소년 자녀들의 건강 증진을 위해서도 매우 유익한 연수라고 생각합니다.",2022.10.17
수업을 살리는 체육 레시피,체육활동이 고민일 때,5점,"초등학교 선생님들에게 체육수업은 언제나 고민입니다. 특히 본인이 운동과 연이 없다면 더욱 그렇습니다.
최고의 연수라고 말할 수는 없겠지만, 체육활동으로 고민중인 선생님들이라면 한 번쯤 들어도 좋을 만합니다.",2022.10.17
English Grammar in Use,영어 공부 초창기에 'grammar in use'로 공부했던 때,4점,영어 학습 초창기에 'grammar in use'의 교재로 큰 마음을 먹고 예문 등 꼼꼼히 공부했던 기억이 있는데 어느순간 머릿속에서 많이 지워진 듯 합니다. 이번 연수를 통해 숨겨져 있던 교재를 다시 꺼내서 다시 단계별로 살펴보려 합니다.,2022.10.17
그림검사와 다양한 기법으로 만나는 미술치료,그림으로 마음을 찾았어요,5점,"그림을 보면서 아픈 마음, 지친 마음, 괴로운 마음들을 치료할 수 있는 시간이어서 소중했습니다.
연수과정속에서 귀중한 도움을 많이 받았습니다. 일상 속에서 만나는 사람들과 부딪치는 일들, 그리고 여러 가지 상황들이 나를 힘들게 할 때 그림을 직접 그려보면서 마음을 달랠 수도 있습니다. 또 다른 사람이 그린 그림을 보고 그 사람의 마음을 미루어 짐작할 수도 있습니다.
단순하게 그림을 그린다고 여겼는데 그 속에서 이런 신비로움을 찾을 수 있다는 것에 연수 수강에 만족했습니다.",2022.10.17
나만의 여행책 만들기,설레는 연수,4점,설레는 연수 잘 받았습니다,2022.10.17
세상에서 제일 쉬운 과학 이야기,과학이 이렇게 쉬울 수가..,5점,"질문으로 풀어가는 과학의 흐름...
국내 과학사 원탑이라 해서 처음부터 믿음이 갔습니다.
또 연수와 함께 들을 수 있도록 책도 주셔서 너무 유익했습니다.
과학의 발전 흐름을 알 수 있어 좋았습니다.",2022.10.17
"학급경영, 수업, 업무 - 노션으로 한 방에 해결하기",노션으로 업무능력 업그레이드,5점,새로운 업무 활용 방법을 알았습니다. 정말 유용한 연수입니다. 설명도 친절하게 잘 해 주시고 천천히 따라 하다보니 노션에 대해 이해할 수 있었습니다.,2022.10.17
교과수업에 활용하는 진로교육,해마다 교원능력개발평가에 진로 항목이 등장하는데...,5점,"교과 수업 최선을 다해 준비하고, 아이들과 좋은 관계를 가지려고 노력하고도 진로항목이 평가 항목에 들어가 있으면 늘 꺼림직 했습니다.
진로 수업이 과연 무엇인지, 교과 관련 진로 수업을 어떤 방법으로 접근해야 할지, 발달 단계 상 지금 제가 접하는 아이들에게 필요한 진로 교육이 무엇인지 알려주는 곳이 없었기 때문입니다.
늘 한번은 찾아서 공부해 봐 야지...생각 하던 중 만난 이번 연수는 저에게 큰 도움이 되었습니다.
단순히 사회의 변화와 직업의 종류 변화를 찾는 기계적인 수업을 넘어서 학생들이 자아탐색과 사회 탐색, 진로계획 수립과 실천에 이르기까지 폭넓은 배움을 얻을 수 있었고, 교과별 적용 방법까지 친절하게 안내해 주셔서 많은 도움이 되었습니다.
필요한 강의안을 바로 다운 받아 활용할 수 있도록 해 주신 점도 참 감사했습니다.
이번 강의를 꼭꼭 씹어 삼켜 교과 수업에 진로교육을 생생하고 활기차게 진행할 수 있도록 하겠습니다.
감사합니다.",2022.10.15
수업을 살리는 체육 레시피,다양한 놀이 및 체육 수업에 대한 아이디어 굿!,5점,다양한 놀이 및 체육 수업에 대한 아이디어들을 많이 공유해줘서 정말 좋았습니다^^,2022.10.14
수업을 살리는 꿀팁 레시피,수업을 살리는 꿀팁!,5점,수업에 대한 고민은 어느 교사에게나 있는데 이 연수는 정말 많은 도움이 되었습니다. 수업을 조금 더 즐겁게 만들어 교사도 학생도 더 행복한 수업 시간이 될 수 있도록 해주셔서 감사합니다!,2022.10.14
"상상을 실천으로, 삶을 바꾸는 사회 수업 이야기",사회 수업에 활용,5점,"사회 수업에 바로 활용가능하겠네요

너무 좋은 연수입니다.",2022.10.14
수업이 즐거워지는 과학 교과서 활용 꿀팁 (초등 3~4학년),5-6학년 연수도 기대됩니다.,5점,"교과서 제작 의도를 알겠습니다.
내년에 3-4학년 담임하고 싶어요 ^^

56학년 연수도 만들어주세요",2022.10.14
저자가 알려주는 수학 교과서 100% 활용하기 (초등 3~4학년),대박 연수,5점,"저자가 직접 알려주시니 이해가 쏙쏙
내년에 3-4학년 담임하고 싶어요 ^^

56학년 연수도 만들어주세요",2022.10.14
과학 세상을 말하다 (과학이 필요한 시간),책준다고 해서 신청했어요,4점,책 주신다고 해서 신청했는데 과학과가 아니라 공부하기 약간 어려웠습니다. 그래도 도움은 되요,2022.10.14
"나이와 신분을 초월한 독립운동, 그 현장을 읽다",역사에 가르쳐 주지 않았던 인물들.,5점,"학창시절에 역사 공부할 때는 각각의 사건에 대한 주요인물들만 무작정 암기했던 기억이 있습니다. 그런데 이번 강의를 통해 제가 미처 몰랐던 수많은 사람들이 있었음을 알게 되었습니다. 특히 평민, 노비 출신 의병단들도 많았다는 점을 알게 되었습니다. 강의를 들을수록 나는 과연 일제 강점기 시절에 독립운동을 할 수 있었을까 의문이 들었습니다. 이 강의를 통해 우리나라를 지키기 위해 죽음을 각오하고 희생하신 분들께 감사한 마음을 다시금 가질 수 있었습니다. 감사합니다.",2022.10.14
성호쌤과 함께하는 랜선 박물관 여행,최고의 강의!,5점,평소에 관심을 갖지 않아 몰랐던 부분들을 알게 해주는 최고의 강의입니다.,2022.10.14
지리와 함께하는 인문학 티타임,최고의 강의^^,5점,평소에 관심을 갖지 않아 몰랐던 부분들을 알게 해주는 최고의 강의입니다.,2022.10.14
세상에서 제일 쉬운 과학 이야기,최고의 강의,5점,평소에 관심을 갖지 않아 몰랐던 부분들을 알게 해주는 최고의 강의입니다.,2022.10.14
교과서 속 세계문화유산,세계문화유산,5점,평소에 관심을 갖지 않아 몰랐던 부분들을 알게 해주는 최고의 강의입니다.,2022.10.14
교사를 위한 교실 밖 여행인문학,힐링이 되는 여행인문학,5점,"교사를 위한 교실 밖 여행인문학은 우리나라 곳곳의 여행지에 대해 자세히 소개해 주고 있어요. 그 지역의 특성, 볼거리, 먹을거리 등을 다양하게 소개해 주고 있어 여행 계획을 세울 때 많은 도움을 받았습니다.

이번에 보령을 1박 2일로 여행을 했는데 이 연수에서 소개한 보령 8경을 다 돌아보지는 못했지만 이름이 낯설었던 오서산을 다녀왔는데 정말로 가을을 만끽한 산행이였어요.

겨울에 울릉도 여행도 계획 중인데 여기서 소개한 홍합밥 꼭 먹어봐야 겠어요. 그 지역의 특성을 연수를 통해 듣고 가면 더 잘 그 지역을 이해하고 즐길수 있을 것 같아요.

근데 연수 구성을 다양한 영상을 넣어 좀 더 재미있게 했으면 하는 아쉬움이 남아요. 내용이 더 있었으면 좋겠고 먹거리 종류가 더 다양했으면 하네요.

이번에 소개하지 못한 지역들로 구성된 여행인문학 두번째 연수를 기획해도 좋을 것 같네요. 연수가 진행되는 동안 간접적으로 그 지역을 체험할 수 있는 즐거운 여행인문학이였습니다.",2022.10.13
"하루 20분, 상황별 생활영어회화 2",영어 전담 및 일상생활 회화 능력 향상에 큰 도움이 됩니다.,5점,"아이들과 수업하면서 나누는 대화들을 패턴형식으로 학습하고 롤플레이를 하다보니 자연스럽게 말할 수 있게 됩니다.
자연스로운 영어 회화를 희망하시는 분들께 강추합니다.",2022.10.13
"나이와 신분을 초월한 독립운동, 그 현장을 읽다",전공이 역사라,5점,"무료연수였고, 전공이 역사라 신청했습니다. 역시 전문적인 지식을 쌓는데 도움이 됩니다.",2022.10.13
성호쌤과 함께하는 랜선 박물관 여행,랜선 박물관에 대해,5점,온라인 기간 랜선 박물관 수업을 한적이 있어 이번에는 교원 연수로 신청했는데 새로운 지식도 알게되고 너무 좋았습니다. 특히 연수에서 알려주신대로 이번에 대한민국역사 박박물관 8층을 가볼 예정입니다 기대되요,2022.10.13
메이슨의 Travel English,쉽고 재미있게 들었습니다.,4점,내용은 쉽고 재미있었습니다. 하지만 내용 수준이 조금 더 높아져도 괜찮을 듯 싶습니다.,2022.10.13
정훈쌤의 뚝딱 칼림바,시간 쪼개서 배우기 참 좋은 연수,5점,"연수받기 편하고 원하는 부분을 듣기도 쉽게 만들어 주셔서 시간 쪼개서 연수들으며 감사했습니다.
시간에 쫓겨서 먼저 이수기간에 이수에 주력했는데 이제 찬찬히 들으면서 실력을 다져 보려고 합니다. 좋은 연수 만들어 주셔서 감사합니다",2022.10.13
정훈쌤의 뚝딱 칼림바,칼림바 연주가 쉬워지는 연수,4점,반 아이들과 칼림바 연주를 하고 있는데 교사인 제가 칼림바에 대해 잘 몰라서 지도에 한계가 있었습니다. 간단한 연주는 할 수 있지만 이론적 지식도 없고 반주를 넣거나 다양한 연주법에 대해서도 전혀 아는바가 없어서 막막했었는데 이 연수를 통해 조금은 더 칼림바 연주에 자신이 생겼습니다. 천천히 여유를 가지고 연수내용을 복습하면서 저부터 칼림바 연주에 익숙해져야 아이들을 지도할 때 더 자신있고 즐겁게 할 수 있을 거 같습니다. 우쿨렐레 연수도 있었으면 좋겠습니다~,2022.10.12
정훈쌤의 뚝딱 칼림바,나도 뚝딱은 아니지만 툭탁 정도로 따라 할 수 있어요~~,5점,"실전 위주의 강의와 실습이 좋았어요. 먼저 악보를 보고 연습 후에 강의 영상을 보고 따라 하면 덜 조급하게 되네요. 악보 프로그램도 유익했고, 실습으로 더 구체적인 배움이 되었습니다. 기본적으로 악보에 대한 이해가 있다면 좀 더 쉽게 이해할 수 있고, 정말 악보 볼 줄도 모르는 수준이면 천천히 복습하면서 강의 들으면 큰 배움이 있을 것 같아요. 아이들 앞에서 당당하게 연주하기 위해 다시 강의 영상 보면서 복습하렵니다~~~",2022.10.12
인성교육 연구보고서 작성법,보고서 쓰기에 두려움을 갖고 있는 선생님들에게 꼭 필요한 연수,5점,"교사 생활을 하면서 수업 공개 외에 교사의 전문성을 보여줄 수 있는 기회는 많지 않다. 매년 비슷하게 흘러가는 시간 속에서 교사로서 성취감을 얻고 학생들의 변화를 보며 만족을 얻을 수 있는 인성교육 연구는 교사라면 한번쯤은 해볼만한 일이라고 생각한다.
하지만 연구보고서라는 큰 부담 때문에 쉽게 도전하기는 어려운 일이다. 나 또한 연구 보고서를 쓰고는 싶지만 어떻게 시작해야 할지 막연하고 두려웠다. 그런데 이번 연수를 만나고 완벽하지는 않지만 연구 보고서는 이렇게 쓰는 것이라는 윤곽과 시기별 해야할 일을 알고 나도 할 수 있겠다는 자신감이 생겼다. 많은 고민과 연구를 하며 나 스스로도 성장하고 전문성을 갈고 닦는 시간을 보내 봐야겠다는 다짐을 하게 되었다. 연구 보고서가 두려운 선생님들은 꼭 연수를 듣고 도전을 해보면 좋을 거 같다.",2022.10.12
정훈쌤의 뚝딱 칼림바,즐겁고 유익한 연수였습니다~^^,4점,"칼림바 배워보고 싶었는데 즐겁고 유익한 연수였습니다.
쉽게 익힐 수 있어 좋지만,
독주로 능숙하게 연주하려면 역시나 충분한 연습이 필수가 되어야 할 것 같네요.
아이들과 즐겁게 합주할 날을 기대하며 열심히 연습시작!합니다^^",2022.10.12
"나이와 신분을 초월한 독립운동, 그 현장을 읽다",한번쯤 들어야하는 연수!!,5점,한번쯤은 들어야 할 연수라고 생각됩니다.,2022.10.12
과학 세상을 말하다 (과학이 필요한 시간),연수좋아요~~,5점,책을 준다고 해서 신청했는데 책이 오기도 전에 연수를 다 들었어요. 과학과 관련된 책들을 소개하며 책의 줄거리를 알려주는데 다양한 것들을 알려주셔서 좋아요. 평소 어떤 책을 고를까 고민이 많았는데 덕분에 책 선택에 도움이 됐어요. 좋은 연수 감사해요~~,2022.10.11
정훈쌤의 뚝딱 칼림바,동아리 시간에 칼림바 연주,5점,학생들의 동아리 시간에 칼림바 연주를 배우고 연습하기를 하고 있습니다. 연수를 받으며 많은 도움이 되고 활용하였습니다. 감사합니다. 주신 악보도 어린이들에게 나누어 주어 활용하고 있습니다. 코로나에 리코더를 불기 어렵고 하여 시작한 칼림바를 연주하며 아름다운 소리와 해냈다는 만족감으로 즐겁게 공부하고 있습니다. 혼자연주도 좋고 친구와 함께 2부 3부로 연주하기도 좋습니다. 열심히 연습하고 있는 어린이들 모습이 정말로 아름답습니다. 선생님들께 적극 추천합니다. 감사합니다.,2022.10.11
"나이와 신분을 초월한 독립운동, 그 현장을 읽다",이 시대 젊은이를 위해 꼭 필요한 연수,5점,"이 연수는 누구나 한번쯤 다 들었으면 해요. 특히 이 시대 젊은이들에게 권하고 싶네요.
나라의 미래를 위해 촛불을 들었던 모든 의인들이 바로 의병이겠고, 의병들의 후손으로서
젊은 피를 가진 모두가 그 의의를 다지는 시간이 될 것 같습니다.",2022.10.11
"나이와 신분을 초월한 독립운동, 그 현장을 읽다",정말 유익한 연수였어요,5점,"역사에 대해 꼭 한번 들어야 할 필수 연수 같아요.
보는 동안 유익한 정보도 얻고 역사 의식도 생긴 것 같아 좋아요,",2022.10.11
교사를 위한 교실 밖 여행인문학,아름다운 우리 나라,4점,지금까지 우리 나라의 여러곳을 다녀봤지만 이번 연수에 나오는 곳과 그곳의 특별한 음식이 무엇인지는 별로 관심이 없었다. 각 지역에 특징있는 음식문화가 있다는 사실조차 큰 관심이 없었는데 이 연수를 통해서 곳곳의 다양한 지역적 특징과 그곳의 음식에 관해서 알 수 있어서 매우 유익한 연수였다. 아쉬운점은 설명과 함께 동영상이 부족했다는 점을 보충해 주었으면한다.,2022.10.11
정훈쌤의 뚝딱 칼림바,유익한 연수! 칼림바 처음 시작하시는 분께 추천해요,5점,"칼림바를 처음 시작하시는 분께 추천하는 연수입니다.
기초부터 중급까지 연수를 통해 익힐 수 있어요.
악보도 보내주셔서 칼림바 연습하는데 도움이 되었습니다.",2022.10.08
"학급경영, 수업, 업무 - 노션으로 한 방에 해결하기",노션으로 또 하나의 뇌를 얻자.,5점,"예전에 노션을 들어보기만 하고 사용법을 몰라 넘겼다가 이 연수를 통해 처음 노션이라는 것을 제대로 알게 되었는데 신세계인 느낌입니다.
익히는데 진입장벽이 있기는 하지만 익숙하게 사용만 한다면 학급 경영, 개인 일상 등 많은 부분에서 큰 도움을 얻을 것 같습니다.
연수들으면서 처음으로 직접 실습해가며 열심히 들었네요!
너무나 좋은 연수라 다른 선생님들께도 적극 추천하고 싶습니다.",2022.10.08
교과서 속 세계문화유산,유익한 연수였습니다.,5점,세계 속의 한국 문화의 우수성을 심도 있게 알 수 있는 유익한 연수였습니다.,2022.10.08
온작품 읽기와 그림을 활용한 깊이 있는 수업,온책읽기 도서 활용에 유익한 연수,5점,"온책읽기 도서를 수업에 어떻게 활용할수 있는지 알려주는 유익한 연수였다.
학년수준에 따라 사용 가능한 도서를 소개해 주어 우리 학년에에 맞는 도서를 정해 학년 선생님들과 협의해 수업에 활용함으로써 아이들의 수업 열의를 끌어 올릴수 있었다.",2022.10.07
