name,title,star,contents,date
교과서 속 세계문화유산,세계문화유산의 매력에 빠져듭니다.,5점,"평소 세계문화유산에 대해 잘 모르고, 제 교과나 전공이 아니며 바쁘다는 핑계로 우리 문화유산을 알아가려는 노력이 없었던 저에게 꼭 필요한 연수이자 느낀점이 많은 알찬 연수였습니다.

교과서나 내가 살고 있는 우리 고장 혹은 우리 안에 귀하고 소중한 세계문화유산이 존재한다는 사실과 그 안에 담긴 의미를 통해 전통과 역사, 우리 선조들의 삶을 다시 한번 이해하고 느끼는 시간이었습니다.

또한 과거 제가 담당했던 업무에도 연결해 이를 적용할 수 있는 점이 많다는 것과 담당 교과와도 묶어서 얼마든지 학생들에게 통합적으로 다양한 사례와 함께 풍성한 수업을 설계하는데 도움을 받을 수 있다는 점도 매력적으로 다가왔고요.
그 외 현재 코로나로 힘들지만 현장체험학습이나 제 개인 여행 등에도 궁투어등 나름의 테마를 구성해볼만한 의미있는 간접 경험이었다는 점에서 기존 너무 무지했던 저를 돌아보며 앞으로 우리 안에 존재하는 세계문화유산에 더욱 관심을 기울여야겠다고 다짐해보았습니다.

앞으로 학생들에게도 제가 깨달은 바를 나누고, 전통과 우리 문화를 통해 인성교육 등에도 적극 활용해보고자 합니다 ㅎㅎ",2021.04.08
메이슨의 패턴잉글리쉬,좋은 연수였습니다.,5점,연수 잘 받았습니다.,2021.04.08
수업을 살리는 미술 레시피,유익한 연수,5점,실제 수업에 활용할 수 있는 구성으로 유익한 연수였습니다. 초등학교 선생님들께서 미술 수업 시간에 활용하기 좋게 내용이 짜여져있네요. 추천합니다.,2021.04.08
메이슨의 패턴잉글리쉬,패턴만 제대로 익혀도 활용도가 높아지네요,5점,부담없이 가볍게 매일 꾸준히 영어공부하기에 좋은 컨텐츠였습니다.,2021.04.07
그림검사와 다양한 기법으로 만나는 미술치료,나에게 힐링,5점,"강의를 수강하며 새로운 이론을 배울 때마다
제가 가르쳤던 학생 중 떠오르는 얼굴들이 있었습니다.
늦게나마 그 아이들을 이해하며 제 마음도 조금 편안해졌어요.
앞으로 아이들에게 힐링을 주기 위해 선택한 연수였는데,
제가 치유되는 느낌이 들었어요.
감사합니다~!",2021.04.07
그림검사와 다양한 기법으로 만나는 미술치료,힐링연수였다,5점,강의를 들으며 마음이 편안하고 긴장이 풀어지며 쉽게 빠져들수 있었습니다. 첫부분에 짧게 보여지는 미술과 친해지기에서 몇가지 아이디어를 얻어 수업에 활용해보기로 했습니다. 감사합니다.,2021.04.06
쉽게 배우고 활용하는 교실 속 손그림 그리기,손그림의 매력을 교사부터 알게 된다면~!,5점,"손그림의 매력을 교사부터 알게 된다면~!
어떨까하는 생각에서 이번 연수를 신청하게 되었습니다.

너무나도 많은 컨텐츠가 있어서 우리반에 맞는 내용을 찾기가 어려울 때가 많았습니다. 이럴 때 일수로 수업을 구성해야하는 교사가 손그림을 활용하여 직접 참여하고, 수업에 바로 응용할 수 있다면 정말 효과적인 수업자료가 될 것이라 생각합니다.

교사 자체가 최고의 교과서이며, 최고의 학습자료가 되기 위해서 노력해야 겠다는 생각을 연수를 수강하면서 많이 떠올렸습니다.

직접 손그림을 그려보니, 재미를 많이 느꼈고 준비물이 연수를 시작하기 전에 도착하여 정말 잘 활용하였습니다. 감사합니다~!
그래서 이렇게 아이들에게도 준비물을 미리 구입해주고, 다함께 시작해보면서 즐거움이 함께 하는 동아리 활동으로 구성하여 운영할 예정입니다.

아이들도 적극적으로 참여하고, 교사도 적극적인 모습을 보여주면서 서로 도와주고 상호작용하는 동아리 활동에 도움이 되었습니다. 다음 손그림 연수가 나온다면 참여해보고 싶고 기대가 됩니다~!",2021.04.03
독립운동 현장읽기 - 구국계몽운동,독립운동의 현장을 생생하게 담은 연수,5점,독립운동을 주제로 유익한 내용이 많이 담겨있어서 수업에 활용하기 좋은 연수였습니다!,2021.04.02
독립운동 현장읽기 - 의병전쟁,"교과서에 제대로 나오지 않지만, 한번쯤은 꼭 학생들에게 설명해 줄 부분을 다룬 연수입니다.",5점,"교과서를 보면 의병전쟁에 대한 부분은 매우 간단히 소개되어 있습니다. 을미의병, 을사의병, 정미의병 이렇게 일어났으며 왜 일어났는지 대표적 의병장은 어떤 사람이었는지 정도만 나옵니다. 하지만 이 연수를 듣게 되면 의병전쟁의 진행사항과 왜 의병운동이 국내에서 지속되지 못했는지에 대해 이해할 수 있습니다. 최근 왕산 허위 의병장의 후손이 국외에서 힘들게 살면서도 선조의 독립운동에 자부심을 느끼는지에 대해서도 곰곰히 생각할 기회가 되는 좋은 연수입니다. 학생들에게 역사를 가르치시는 선생님들께서는 꼭 들어야할 연수라고 생각합니다.",2021.03.31
쉽게 배우고 활용하는 교실 속 손그림 그리기,그림에 소질이 없지만 노력해서 잘해보고 싶으신 선생님들께 강력 추천합니다.,5점,"겉으로 봤을 땐 간단한 것 같지만, 의외로 그리기 힘든 동물이나 사람의 동작을 잘 설명해주는 연수입니다. 듣다보면 아 그렇구나 하고 고개를 끄덕이게 됩니다. 이 연수를 듣고 꾸준히 그린다면 간단한 손그림 그리기 능력이 매우 발달할 수 있습니다",2021.03.31
이것이 진짜! 코로나19 이후 경제전망,코로나19의 빛과 그림자,5점,조금 부끄럽지만 원래 경제에 대해 큰 관심이 없는 편이었는데 코로나 19로 외부활동을 많이 안하다보니 경제에 관심을 갖게 되었습니다. 포스트 코로나 시대의 경제전망에 대한 강좌여서 실용적이고 도움이 많이 되었습니다. 꼭 들어보세요^^,2021.03.30
"[고1, 고2 입시전략 특강] 대학진학은 전략싸움이다!","고1, 고2 학생들에게 알려주는 입시전략",5점,"군더더기 없는 깔끔한 설명 좋습니다.
고1, 고2 학생들에게 입시에 대해 설명해주기 좋겠네요.",2021.03.30
[2022학년도 입시전략 특강] 대학진학은 전략싸움이다!,2022학년도 대학입시에 대한 개요,5점,"어떤 방향으로 설정해야하는지 큰 도움이 되었습니다.
감사합니다!",2021.03.30
메이슨의 Travel English,해외여행을 꿈꾸며^^,5점,이렇게 해외여행을 간절하게 기다리기는 처음입니다. 코로나19로 국내여행조차 어려운 이 시기에 당장은 여행을 떠나지 못하지만 곧 그 날이 올거야 라는 희망으로 연수를 신청했습니다. 연수를 듣는 동안 스위스 마테호른을 바라보는 모습을 상상하기도 하고 기내에서 스낵을 부탁하는 저의 모습을 그려보기도 하면서 재미있고 실감나게 연수를 들었습니다. 매일 아침 일찍 출근해서 30분간 소리내어 공부하는 재미! 의외로 좋습니다. 곧 여행영어를 사용하는 날이 오겠죠?,2021.03.30
독립운동 현장읽기 - 의병전쟁,의병에서 독립운동으로,4점,"조선말의 외세와 관련하여 우리 조상들의 저항의 힘이 느껴집니다.
위정척사, 을사늑약, 군대해산, 진공작전의 아쉬움을 뒤로 하고
면면히 이어지는 우리 배달겨레의 숨소리를 잘 들었습니다.
의병운동, 독립운동, 그리고 해방과 오늘에 이르기 까지..
잊지말고 우리가 지켜야 할 나라 대한민국,,, !! 화이팅",2021.03.30
독립운동 현장읽기 - 구국계몽운동,독립운동 현장에 대한 심층적 강의!,5점,"학생들은 사회를 어려워하면서도 역사 부분은 참 열심히, 재미있게 듣습니다.

역사 파트 지도하면서 자세한 역사적인 사건들을 들어 설명하면

학생들이 눈이 초롱초롱해집니다. 제 수업에 더할 수 있는 좋은 강의 잘 들었습니다.

감사합니다!",2021.03.22
2022학년도 입시전략 특강 - 대학진학은 전략싸움이다!,꼭 듣고 싶었던 연수,5점,초등교사이지만 대학입시를 이해하고자 한번쯤 들어보면 도움되는 연수입니다.,2021.03.18
"하루 20분, 컬쳐 리스닝 픽업",유쾌한 연수,5점,리스닝 실력은 좀처럼 늘진 않았지만 유쾌하게 듣고 즐거웠던 시간이었습니다. 우리 문화재에서도 좀더 자세히 알게 되었네요. 감사합니다.,2021.03.18
"[고1, 고2 입시전략 특강] 대학진학은 전략싸움이다!",고1 조카를 위해,5점,입시 조언을 해주기에 들어볼만한 연수입니다.,2021.03.18
독립운동 현장읽기 - 의병전쟁,3.1운동 102주년을 기념해서 정말 좋은 연수,5점,"3.1운동과 의병에 대한 여러가지 이야기를 듣고
많은 사람들에 대해 알게 되어 좋았습니다.
연수를 통해 저 자신의 성장은 물론 아이들에게도
해줄 이야기가 늘어났다는것이 제일 좋았습니다.
감사합니다.",2021.03.17
English Grammar in Use,부담없이 매일 20분씩 듣기 좋습니다.,5점,아침 출근해서 20분 부담없이 듣기에 좋습니다.,2021.03.16
독립운동 현장읽기 - 의병전쟁,현장에세 아이들에게 나라사랑을 가르쳐야겠습니다.,5점,지금처럼 나라 안팎으로 어려운 시기일수록 우리나라가 겪어온 현장감 있는 연수의 필요성을 느낍니다. 특히 독립운동가들의 뜨거운 피의 댓가로 내가 있고 우리 가족이 있고 우리나라가 존재함을 느낄 수 있어 감사한 연수였습니다. 우리 아이들에게 나라의 소중함 또는 나라사랑에 대해 교사로서 교육이 마땅히 필요함을 느낍니다. 감사합니다.,2021.03.07
독립운동 현장읽기 - 의병전쟁,독립운동에 대해 이해하는 깊이 있는 시간,5점,독립운동에 대해 이해하는 깊이 있는 시간이었습니다. 고맙습니다.,2021.03.04
그림검사와 다양한 기법으로 만나는 미술치료,아이들의 마음을 읽고 싶은 교사들이 들어야 하는 연수!,4점,"평소에 아이들의 그림을 보면서 그림에 아이들이 쉽게 말하지 못하는 여러 감정과 환경들이 담겨있다는 것을 느꼈어요. 하지만 제가 전문가가 아니니 그냥 위클래스 선생님께 상담 지원을 요청하거나 제가 아이의 그림을 보고 대충 그 상황과 마음을 짐작하는 수밖에 없었죠. 제가 조금이나마 그 아이의 마음을 알아주지 못해서 아쉽고 미안했는데 우연히 이 연수를 발견해 듣게 됐어요^^

이 연수에서는 교대 미술교과교육론에서 배웠던 기본적인 이론들부터 학생들과 직접 그림 검사를 해보고 적용하는 과정까지를 총체적으로 다루고 있는 연수예요. 시각형/촉각형 아이들에 맞는 드로잉 재료, 기법들, 아이들과 평상시에 할 수 있는 검사들 등에 대해서도 자세히 나와있어 많이 배울 수 있었어요^^ 아이들의 다양한 특성을 인정해주면서 미술 수업을 할 수 있게 되기도 했고, 읽기 어려웠던 아이들의 마음을 그림으로 조금이나마 더 알아줄 수 있을 것 같다는 자신감이 생겼죠^^ 미술에 아예 관심이 없었던 저에게는 정말 꼭 필요한 시간이었죠~ 하지만, 그림 검사 해석에 대해서 조금 더 다양하게 알려주셨으면 하는 아쉬움이 있어 4점을 드렸습니다! 그것 빼곤 알찬 연수였어요^^

저처럼 미술에 관심이 없었던 선생님, 아이들의 마음을 알고 싶지만 잘 모르겠는 선생님, 아이들과 좋은 래포를 형성해 잘 가르치고 싶으신 선생님들께 이 연수를 추천합니다^^",2021.02.28
독립운동 현장읽기 - 구국계몽운동,3.1절을 앞두고 의미있었던 연수,5점,3.1절을 앞두고 의미있었던 연수였습니다. 감사합니다.,2021.02.22
독립운동 현장읽기 - 의병전쟁,독립운동에 대한 심화를 원한다면,5점,"교과서 밖의 귀한 독립운동, 그 중에서도 의병운동 중심의 심화적 배움을 원한다면 이 연수를 적극 추천합니다.

비록 교재가 없고, 그만큼 깊이있는 강의를 들어야한다는 점도 알립니다.

이번 연수 후, 학생들에게 지식과 이해의 폭이 깊고 넓어짐에 따라서 더욱 확신있게 학생들을 지도할 수 있을 것이라 생각합니다.

독립기념관과의 콜라보, 좋았습니다.",2021.02.18
옆반 쌤이 알려주는 꿀팁(온라인 수업편),온라인 수업 제작의 기-승-전-결,5점,온라인 수업 제작을 효율적으로 할 수 있도록 도움을 주는 좋은 연수입니다.,2021.02.14
쉽게 배우고 활용하는 교실 속 손그림 그리기,손그림 그리기 연수 후기,5점,1학년을 처음으로 맡게 되어 여러 가지로 걱정이었는데 이 연수를 마치니 걱정이 덜 되는 것 같다. 감사합니다.,2021.02.14
교육과정을 뒤집다! 백워드 통합단원 설계,백워드 수업 감사히 잘 들었습니다.,4점,학생들에게 정말 필요한 요소들을 어떻게 하면 잘 전달할 수 있을까?라는 모든 선생님의 고민을 덜어주는 하나의 방법을 통해 또 배웁니다. 대한민국의 선생님들의 열정에 다시 도전받고 2021년 나의 수업을 듣고 학생들에게 도움이 될수 있도록 제대로 준비해야겠다는 다짐을 하는 시간이었습니다.,2021.02.05
7인의 전문의와 함께하는 메디컬 콘서트,잘 들었습니다.,4점,잘 들었습니다.,2021.02.02
이것이 진짜! 코로나19 이후 경제전망,경제에 관심을 갖게 되었어요,4점,"생각하지 못했던 코로나 세상으로 모든것이 엉망이 되고 일상이 얼마나 고맙고 행복한것인지 알게 되었답니다. 코로나 이후의 경제 전망을 보면서 놀라운 것들을 알게되었어요.
급변하는 시대에 적응하기 위해서는 경제 전망에 대해 이해하고 잘 적응해야 한다는 사실도 알게되고 우리가 생각했던 속도보다 더 빠르게 변화하는 상황에 어떻게 대처해야 하는지 알게된 유익한 시간이었습니다.
코로나가 지나간 이후의 삶의 환경도 많이 변화되리라 생각하는데 꼭 연수 들어보시기 바랍니다",2021.01.31
기초영어 회화 핵심표현 Real Speaking,자신감이 생겼어요,4점,"기초영어 회화 핵심표현 리얼 스피킹을 신청하고 처음에는 고민을 했어요. 시간도 없고 바쁜 학년말에 이 연수를 신청해서 괜히 신청했다고 생각하며 들었어요.
영어 표현에 대해 자신감도 없고 기초회화도 잘 못하므로 이제부터 준비해서 얼마남지 않은 교직생활을 잘 해야겠다고 다짐하면서 들었어요.
정년퇴임을 하고 여행도 하려면 기초회화 정도는 해야겠다는 생각은 했지만 공부하기가 쉽지 않아 손을 놓고 있었어요.
연수를 들으면서 조금씩 흥미가 생기고 자신감이 생기기 시작하면서 연수신청을 잘 했다고 마음이 바뀌었어요.
기초영어 회화 핵심표현의 좋은점은 같은 유형의 회화를 다양하게 다루어주어 저같은 왕초보에게 너무나 유익한 연수인것 같아 망설이지 마시고 공부해보세요.
방학동안 단어도 공부하고 짧은 회화도 반복학습 하면서 자신감이 생겼어요.
얼마남지 않은 교직생활동안 한마디라도 자연스럽게 이야기할 수 있을 정도로 영어 실력을 기워야겠다고 생각한 나에게 딱 맞는 연수였어요. 복습을 하면서 공부를 더 하고 영어 울렁증에서 벗어나 보려고 노력하고 있어요.
망성이고 계시는 분들은 한번 도전해 보세요. 재미있게 공부를 해서 행복한 시간이었어요",2021.01.31
7인의 전문의와 함께하는 메디컬 콘서트,건강이 최고!,5점,"50대이후 건강이 더 중요하고 절실해집니다. 내가 건강하고 컨디션이 좋아야 학생들과의 소통도 원할해집니다. 특히, 생리통으로 힘겨워하는 여학생들을 격려하고 위로해 줄수 있겠네요. 감사드립니다~^^",2021.01.31
메이슨의 패턴잉글리쉬,패턴으로 유창해지는 영어회화,5점,"강의 주제체럼 해야할 일 말하기, 축하하기, 후회 및 준비 등 일상 생활에서 많이 쓰이는 상황 30가지 선정해 패턴화하여 학습하게 해준다. 예를 들어 '선호'가 주제이면 'prefer 선호하는 것 to 덜 선호하는 것'을 제시 간단 명료하게 패턴을 익히게 하고 그것을 저는 맺주보다 소맥을 더 좋아해요. 고기보다 해산물을 선호해요. 등 패턴에 어울리는 문장을 6개정도를 학습한다.
이렇게 익힌 문장을 '다양하게 응용하기'를 통해 대상, 시제, 의문 및 부정문으로 바꾸어 표현하는 연습을 하여 학습 효과를 더 높여준다. 또 강사님은 친절하게 지금 공부하세요 하시며 '따라하기'와 정리'review'로 이어가신다.
강의를 듣는 것이 아니라 함께 공부하는 느낌이라 좋다.
그렇게 25분 내외를 강사님과 학습 후에 퀴즈 2문제와 마지막 정리하기를 통해 학습을 강화하게 된다.
한 강좌 당 30분정도의 학습 시간으로 유용한 표현을 유창하게 말하고자 했던 내 목표를 성취할 수 있었다.
초급 회화로 매우 유익하다고 생각하며 추천한다.",2021.01.31
활동하고 토론하는 통합사회 수업방법,통합사회 수업에 막막하신 분들을 위해 강추!,5점,"1. 교과서 내용 설명

-> 해당 단원 교과서 내용 설명을 통해 어떤 식으로 학생들에게 설명해야

할지에 대한 팁을 얻었습니다.

2. 해당 단원에 활용할만한 활동 및 실제 사례 제시

-> 모의투자 게임이나 인권 여행 계획서 등 해당 단원에서 활용할만한

참신한 여러가지 활동을 제시해주고, 실제 수업에 응용할 때 막연하지

않도록 수업 사례까지 포함시켜 주신 점이 큰 도움이 되었습니다.

3. 수업 자료 제공

-> 다양한 수업 자료를 얻을 수 있는 사이트를 알려주셔서 NIE 활동과

같이 데이터가 필요한 활동을 진행하는데 큰 도움이 얻었습니다.



결론) 통합사회 수업을 어떻게 해야할지 모르겠는 선생님분들에게 정말

강추하는 연수입니다!",2021.01.25
교사 자존감 수업,자존감 높은 교사가 되기위해,4점,"제가 이 연수를 들었다는 것은
교직생활로 인해 저의 자존감이 낮아졌다는 의미겠죠?
같은 고민을 가진 선생님들을 위해 이런 연수가 만들어지지 않았나하는 생각이 들면서 한편으로는 위로가 되고 또 한편으로는 안타까웠습니다.

이 연수는 강의식으로 교사의 자존감을 떨어지게하는 상황들, 예시들 그리고 이에 대한 대처법, 치유법 정도로 구성되어있다고 보시면 됩니다. 선생님들이 강사가 되서 이런저런 얘기를 해주시는데 각각의 사연마다 저의 모습을 보는 것 같아 공감이 되었습니다.

각 강마다 그에 맞는 대처법이나 치유법을 제시해주지만 이것을 선택하는건 저의 몫인것 같아요. 좋은 것은 받아들이고 맞지 않은 것은 받아들이지 않으면서 저의 자존감을 높이는 방법들을 하나씩 터득해가려고 합니다. 2021년은 교사로서 자존감을 높이겠 소~^^",2021.01.25
'척' 하면 '딱' 붙는 대입 진학지도,해도해도 어려운 입시지도,5점,"깔끔하고 간략하게 잘 정리되어있어

작은 시간으로도 대학입시의 큰 틀을 이해할 수 있어 좋았습니다.

매년 공부하는 마음으로 연수를 통해 입시 흐름을 이해하면 좋을 것 같습니다.",2021.01.24
메디컬 콘서트 1탄 - 현대인의 만성 질병,교사에게 꼭 필요한 연수,5점,"겨울방학이라 부담없이 연수를 듣고 싶어 검색하던 중 눈에 딱 띄인
현대인의 만성질병.
나이가 어느듯 40대중반인지라 건강에 더 관심이 많아지는데 정말 나를 위한 연수라 신청해 보았습니다. 요즘들어 침침한 눈. 이게 나이탓인지 내가 막 사용해서 그런지 궁금했는데 연수를 통해 답을 얻었습니다. 현대인의 만성질병이지만 연수 자체가 교사의 만성질병이라고 해도 될만큼 우리 교사들의 맞춤형연수라고 생각됩니다.
건강연수이다보니 본강의 후 3~5분 가량의 요가가 있는데 간단한 동작은 따라하니 스트레칭도 되고 좋았습니다. 좋은 연수 및 강의 감사드립니다.",2021.01.19
옆반 쌤이 알려주는 꿀팁(온라인 수업편),짧고도 굵은 좋은 연수였습니다.,5점,"15차시에 너무 좋은 내용이 많이 들어있었어요.
온라인 수업을 시도하려는 분들께 기초로 입문하기 좋고
어느 정도 알고 있었는데도 몰랐던 부분을 발견할 수 있어 좋았어요.
알고 조금씩 해보다 보면 능숙해질 날이 오겠죠?
그리고 모두 교사 선생님들이셔서 더 친근하고 고충을 알고 공감해주시는 부분이 정말 좋았어요.
옆반 쌤이 알려주는 꿀팀! 온라인 수업편 이후 다른 연수도 올라올 거 같은데 기대하며 기다릴게요~",2021.01.19
그림검사와 다양한 기법으로 만나는 미술치료,미술치료와 내 마음 치료,5점,먼저 연수를 통해 미술에 대한 편견이 없어졌다는 것이 큰 소득 중하나이다. 미술은 꼭 잘해야 될 것 같은 과목이다. 특히 감상을 하고 비교를 하다보면 더욱 그렇다. 하지만 이 연수를 통해 미술은 단지 도구일 뿐이고 그림에 투영된 내면의 생각이나 사고에 더욱 집중하기 때문에 미술을 보는 관점이 달라진다. 또한 어려운 상담이나 치료에 대한 부분을 알기 쉽게 설명해 주고 사럐를 통해 실제적인 것을 배울 수 있어서 유익했다. 다만 개선을 한다면 강연을 말로만 하기 보다는 자료라던지 혹은 ppt를 이용하여 정리하면서 했으면 좋겠다.,2021.01.16
같이 읽고 함께 나누는 독서수업방법,한 학기 한권 읽기의 방향,4점,"이 연수는 확실히 초등학생을 위해 만들어졌지만 중학교 1학년까지 유용하게 활용할 수 있어요!
한 학기 한권 읽기를 지루하지 않고 학생 참여형으로 구성하고 싶어서 연수를 듣게 되었는데 중학생을 위한 독서교육에도 많은 도움이 되었습니다.
아쉬운 점은 코로나 시대가 반영된 독서교육 연수도 나왔으면 좋겠습니다. 연수 활동이 코로나 이전에 가능한 활동들이 많아서 코로나를 반영한 원격 수업용 독서교육 연수도 있었으면 좋겠어요~
감사합니다^^",2021.01.16
옆반 쌤이 알려주는 꿀팁(온라인 수업편),유용한 연수,5점,자세한 설명으로 유용했습니다.,2021.01.14
그림검사와 다양한 기법으로 만나는 미술치료,아이들의 그림,4점,아이들의 그림에 더욱 관심을 갖게 되었다.,2021.01.12
수업을 살리는 미술 레시피,다양한 미술 수업 활동,5점,즐겁게 잘 배우고 갑니다^^,2021.01.11
스토리텔링을 활용한 초등수학 수업,교사 위주의 단조로운 수업을 진행하는 교사에게 추천,3점,다양한 스토리텔링 방법을 활용한 수학 수업을 배우게 된 계기가 된 것 같습니다. 유익한 연수 감사합니다.,2021.01.11
옆반 쌤이 알려주는 꿀팁(온라인 수업편),시기적절한 연수였습니다.,3점,"온라인 수업에 대한 관심과 요구가 커지는 시점에 교사들에게 필요한 연수 내용이었습니다.
다만 여러 선생님께서 함께 만드신 연수라 그런지
차시별 수업 내용의 수준과 강의하시는 선생님들의 수업 방식 및 전달력에 차이가 크게 느껴져 아쉬웠습니다.
또한
15차시 중 한 차시를 강사선생님들의 연수 후기로 채워진 것도 의아합니다.
강사분들의 연수소감이 수업을 차지하는 건 처음 겪는 일이었습니다.....
온라인 수업이 점점 강조되고 있는 상항에서 온라인 수업에 대한 다양하고 알찬 연수가 많아지길 기대합니다.

(참고로 온라인 시험 중 9번 문제가 질문형이 아닌 설명하는 문장이라 당황스러웠습니다. 문제 오류 확인 부탁드립니다.)",2021.01.09
수업을 살리는 체육 레시피,팁 얻어가요~,5점,체육활동 하기에 만만치 않은 상황이지만 유용한 정보 배우고 갑니다^^,2021.01.09
