name,title,star,contents,date
수업을 살리는 꿀팁 레시피,괜히 꿀팁이 아니네요.,5점,"복직후 급 변화한 학교 현장에 적응하기 힘들었는데
강사님의 꿀팁전수 감사합니다.",2021.12.15
손그림과 파워포인트로 교실 속 콘텐츠 만들기,손 그림에 자신감이!,5점,"학습자료로 교사 커뮤니티에서 손그림이나 파워포인트를 많이 사용하는 편입니다. 늘 다른 선생님께서 만들어주신 것만 사용했는데 이제는 저도 할 수 있겠다는 자신감이 들어요!
연수들으며 직접 그려볼 수 있는 연수 자료까지 증정해주니 더 좋네요^^ 연수 끝나고도 연습할 수 있을 것 같아요.",2021.12.15
재테크보다 중요한 나만의 재무설계,좀 더 일찍 알았으면 좋았을 것 같아요.,5점,재무에 관해서는 관심은 있어도 뭘 어떻게 해야할지 몰랐는데 이번 연수를 통해서 조금은 알 것 같아요. 이번 연수를 통해서 잘 배웠습니다.,2021.12.15
"김준우의 톡(Talk)톡(Talk)한국사, 한국사능력검정시험-전근대사",나를 깨워준 한국사,5점,"우리나라 역사에 관심이 많고 공부하는것도 싫어하지 않는 편인데 한국사 중에서 근대사에 자신감이 없었다.
중고등학교 시절에 조선의 전기까지는 그래도 잘 이해하고 공부해서 지금도 힘들지 않은데 조선말 근현대사가 자신이 없었다.
이번 연수를 들으면서 일목요연하게 정리해 주어서 이해가 잘되고 한눈에 쏙
쏙 들어왔다.
나를 깨워준 김준우의 톡톡 한국사 연수였다. 자신감을 갖게 하고 근현대사를 잘 이해할 수 있어서 이 연수가 좋았다.
우리 나라의 역사를 한번에 잘 이해하고 중요한 내용을 콕콕 정리한 시간이었다. 특히 고학년 선생님들은 꼭 이 연수를 듣고 역사를 지도하시면 좋을것 같고 저학년 선생님들도 수업시간에 학생들에게 잘 설명할 수 있을것 같다.
나를 깨워준 한국사 연수 자신감이 뿜뿜 솟게 한 연수였다.",2021.12.14
지리와 함께하는 인문학 티타임,할머니가 들려주시던 옛날 이야기 같은 행복연수,5점,"지리하면 조금 딱딱한 느낌이 드는데 이번 연수를 들으면서 할머니의 옛날 이야기가 떠올랐다.
긴긴 겨울밤 할머니 주위에 옹기종기 모여서 옛날 이야기를 들으면서 행복한 시간을 가졌는데 그때의 기억을 새록새록 떠오르게 하는 시간이었다.
길의 탄생을 들으면서 자연의 이치에 어긋나지 않게 길을 만들고 지혜롭게 생활한 선조들의 삶을 엿볼 수 있다.
여러지역의 지명에 얽힌 이야기는 정말 옛날 이야기 그 자체다.
여러가지 문학 작품과 연계하여 설명하는 지리는 더 흥미를 갖게 했다.
우리 나라의 지리와 문학뿐만 아니라 외국의 문학작품도 수업시간에 지리를 지도하면서 함께 지도할 수 있어 좋았다.
특히 다양한 수업 경험을 이야기하고 묻고 대답하는 형식의 연수 내용이 지루하지 않고 좋았다.
선생님의 다양한 경험을 바탕으로 책을 쓰고 책을 보면서 연수를 들으니 더 집중이 되고 이해가 잘 되었다.
선생님들도 꼭 이 연수를 들어보라고 권하고 싶다",2021.12.14
기후변화 이야기,실천이 가장 필요한 이야기,5점,"기후변화에 대해서는 많은 사람들이 이야기를 한다.
우리가 살아갈 환경이고 미래 세대가 살아가야 할 환경이다.
기후변화로 인해 많은것이 사라지는 지금의 상황을 그저 바라만보고 있으면 안될것 같다.
실천이 가장 펼요한 이야기가 기후변화 이야기인것 같다.
이번 연수를 통해 아주 작은것부터 실천하는 습관을 갖게 되고
우리가 살아가야 할 환경의 중요성을 다시한번 깨닺게 된 시간이었다.
선생님들이 먼저 이해하고 실천하면서 학생들에게 지도하는것이 가장 효과적인 교육이고 많은 영향을 주는데 이 연수를 통해 선생님들이 먼저 변화되는 삶이 되길 바라며 이 연수를 적극적으로 추천하고 싶다.",2021.12.14
통통한 과학이야기 2,통통한 과학이야기2,5점,문과생이 듣기에 좋은 연수입니다.,2021.12.14
재테크보다 중요한 나만의 재무설계,재테크보다 중요한 나만의 재무설계,5점,재테크보다 중요한 나만의 재무설계 열심히 재미있게 잘 수강하겠습니다.감사합니다.~^*^,2021.12.14
이것이 진짜! 코로나19 이후 경제전망,경제에 관심이 생겨 들어봤어요,5점,좋아요,2021.12.14
인성교육 연구보고서 작성법,연구보고서...,5점,"매번 계획서는 작성해보았지만... 보고서는 어떻게 쓰는 건가 싶어..
넘어갔는데 아직도 갈 길은 멀지만..
이 연수를 통해 조금이나마 머릿속에 틀이 잡힌 거 같다.
연구보고서를 준비하는 분이라면 들어보라고 강추한다!",2021.12.14
초등 선생님을 위한 토닥토닥 공감교실 만들기 노하우,좋아요,5점,좋아요,2021.12.14
수업이 즐거워지는 과학 교과서 활용 꿀팁 (초등 3~4학년),미리보기,5점,올해 이 교과서를 미리 볼 수 있어 좋았어요. 계속 저학년만 하다 오랜만에 과학 교과를 가르치게 되어서 힘든 점이 많았는데 이 연수를 들으니 내년에는 자신감을 가지고 과학수업을 할 수 있을 것 같습니다.^^,2021.12.14
기후변화 이야기,기후변화는 다음 세대를 위해 꼭 필요합니다!!,5점,"교사들이 기후변화에 관심을 갖는다면

다음 세대인 아이들이 살아가는 세상은

살기 좋은 세상이 되지 않을까요?

우리 모두 노려해봐요!!",2021.12.14
"하루 20분, 컬쳐 리스닝 픽업",컬쳐 쇼크!! 컬쳐 리스닝!!,5점,"좋은 연수네요^^

리스닝에 자신 없는 선생님들~

어서들 들어요^^",2021.12.14
온작품 읽기와 그림을 활용한 깊이 있는 수업,온작품 읽기는 필수입니다!!,5점,"온작품 읽기에 어려움을 느끼는 선생님들~~

이 연수 맛집이에요^^

어서들 오세요!!",2021.12.14
"엑셀, 파워포인트 2013 기초부터 인포그래픽 활용까지!","엑셀, 파워포인트에 대한 자신감 쑥쏙!!",5점,"자신 없는 교사들이여~

이 연수를 들으라!!",2021.12.14
"하루 20분, 컬쳐 리스닝 픽업",야! 너두 리스닝 할 수 있어!!!,5점,"야나두까진 아니지만ㅋ

좋은 강의입니다!!

리스닝에 자신감이 생기네요^^",2021.12.14
기후변화 이야기,환경에 관심이 생겼어요~!!,5점,"내가 몰랐던 환경에 대한 다양한 정보와

환견을 생각하게 만드는 좋은 강의입니다!!

적극 추천합니다!!^^",2021.12.14
수업을 살리는 놀이 레시피,살리고~ 살리고~ 수업을 살리고~!!,5점,"내 수업이 재미없다!!

내 수업에 자신없다!!

이런 분들에게 적극 추천합니다!!

후회하지 않을거에요~~^^",2021.12.14
"김준우의 톡(Talk)톡(Talk)한국사, 한국사능력검정시험-근현대사",쏙쏙정리되는 톡톡 한국사,5점,"한국사능력검정시험을 준비하는 중에 관련된 강의가 있어서 듣게 되었습니다.
중요한 내용을 잘 짚어주시고 강의시간도 적당해서 집중하는 데 도움이 되었고 자막이나 효과음 등 과하지 않은 정도로 편집된 영상도 보기에 좋았습니다.",2021.12.14
옆반 쌤이 알려주는 꿀팁(실시간 쌍방향 수업편),유익한 연수 ^^,5점,"전부터 듣고 싶었는데 시간이 없다, 바쁘다 핑게로 이제야 했어요^^ 수업하는데 도움이 많이 될 것 같아요^^",2021.12.14
한 번에 끝내는 법정연수 1,보통 연수,3점,보통 연수,2021.12.14
기초영어 회화 핵심표현 Real Speaking,시험이 어려움,1점,시험이 어려움,2021.12.14
7인의 전문의와 함께하는 메디컬 콘서트,굿~!,4점,굿~!,2021.12.14
세상에서 제일 쉬운 과학 이야기,과학에 대해 잘 알 수 있는 연수,5점,과학에 대해 여러가지 방면에서 다양하게 설명해주셔서 좋았어요. 단편적으로만 알고 있던 과학 지식을 통합적인 측면에서 알게 되어서 좋았습니다.,2021.12.14
교사를 위한 교실 밖 여행인문학,인문학을 생각해보며 풍족한 여행이 될 수 있는 연수,5점,"여행을 통해 다양한 시야를 얻게 되는데, 교사를 위한 교실 밖 여행인문학은 여행 속에서 더 넓은 사고를 할 수 있도록 도와주는 연수입니다. 인문학과 연결되니 여행이 더욱 풍족해진다고 느껴집니다.",2021.12.14
쉽게 배우고 활용하는 교실 속 손그림 그리기,"짧지만 굵은, 재미있으면서도 꼭필요한~",5점,제목처럼 15시간 짧은 연수지만 교직생활에 꼭 플러스 알파가 될 수 있는 알찬 연수였습니다. 그림을 잘 못그리는 그린이? 들도 쉽게 따라서 그려가며 차근차근 배울 수있고 실습할 수 있는 준비물들도 알차게 챙겨주어서 좋았습니다~ 또다른 알찬 연수 기대할게요~,2021.12.13
초등 고학년 탐구생활,고민을 시원하게 해결해주는 강의,5점,고학년 학생을 대하면서 느낀 고민과 어려움을 해결해주는 강의입니다.,2021.12.13
손그림과 파워포인트로 교실 속 콘텐츠 만들기,올해 꼭 실천하려고 합니다.,5점,"올해 6학년 졸업생들에게 줄 문집을 만들고 있는데, 그 문집에 학생들을 한 명씩 손그림으로 그려서 선물해 주고 싶어요. 저는 의욕만 앞서서 그림 그리기와 관련된 펜들은 많은데 정작 사용을 잘 못하고 있었거든요. 올해가 가기 전 꼭 성취하도록 하겠습니다. 실용적인 연수 감사합니다.",2021.12.13
그림검사와 다양한 기법으로 만나는 미술치료,보기 드문 미술치료 강의,5점,"미술 치료에 관한 연수를 수강하고 싶었는데, 생각보다 마음에 드는 커리큘럼을 가진 연수를 발견하기가 쉽지 않았습니다. 교실 환경에서의 구체적인 가이드라인을 제시해주셔서 감사합니다.",2021.12.13
2학점(30차시) 연간수강권,행정 처리에 굿,5점,수강권이 있으니 미리 구매하고 나중에 원하는 강좌를 듣기가 좋습니다,2021.12.13
수업을 살리는 체육 레시피,늘 막막했던 체육 수업,5점,"경쟁형 게임 활동만 하면 학생들의 운동기능과 협동능력을 키워주는 데 한계가 있기에, 늘 고민이 컸던 부분이 바로 '체육수업'입니다. 단순한 운동기능연습, 전략연구를 넘어서 어떻게 하면 놀이형 기능 훈련 활동을 제시해줄 수 있을까에 대한 구체적인 도움을 얻을 수 있었습니다.",2021.12.13
교과서 속 세계문화유산,여행가는 기분으로!,4점,"아는만큼 보인다는데 잘 몰라서 그냥 지나쳤던 문화유산들을 자세히 알수 있어서 좋았고, 이제 여행가서 설명해 줄 수 있을 것 같아서 자신감이 생겼습니다! 보러가지 전에 다시 복습하고 떠나야할 것 같네요^^",2021.12.10
손그림과 파워포인트로 교실 속 콘텐츠 만들기,초등학교 교사에게 너무나 도움이 되는 연수,5점,"작년에 개인적인 사정으로 휴직을 하고 올해 복직을 했어요. 작년 1년 동안 코로나로 학교 현장은 몹시 혼란스러웠겠지만 또한 학습이나 수업 환경에 비약적인 발전이 있는 것을 보고 너무나 당황스럽고 어떻게 따라가야 하나 많은 고민이 있었습니다.
그래서 여기저기 온라인 플랫폼 관련 연수, 수업 툴에 관한 연수도 듣고 다른 선생님들이 제작한 컨텐츠 등을 보며 저렇게 효과적인 자료 등을 어떻게 만들까 부러운 생각이 들었어요. 그러다 이 연수까지 듣게 되었습니다.
이 연수의 전반부는 직접 그림을 그려서 만들 수 있는 다양한 학습 자료와 이것을 디지털화하여 수업 현장에 이용할 수 있는 구체적인 방법을 알려줍니다. 그래서 그림에 관심이 있거나 잘 그리시는 선생님은 정말 저작권에 구애받지 않는 자신만의 자료를 생산해 내실 수 있습니다.
후반부의 경우 파워포인트만으로 다양한 학습 자료나 학급 운영 자료를 만들 수 있는 방법을 소개해 줍니다. 학급 신문이나 화폐 등 교실 현장에 바로 적용할 수 있는 유용한 자료를 만드는 방법을 배울 수 있었습니다.
강사분께서 초등학교 선생님이어서 내용 선정 등도 초등교사에게 정말 꼭 필요하고 제가 알고 싶었던 내용이어서 너무나 도움이 되는 연수였습니다. 감사합니다.",2021.12.09
독립운동 현장읽기 - 의병전쟁,간단하게 의병항쟁이었구나 가 아니었어요,5점,이렇게 많은 곳에서 이러한 노력이 있다는걸 기억하고 전달해야겠습니다.,2021.12.09
지리와 함께하는 인문학 티타임,인문학에 빠져보시렵니까?,5점,"평소 마음의 양식을 쌓기 위해서 인문학을 탐독하고 싶었는데
책을 주는 연수라 한번 신청해봤더니,
흔히 걷던 길에 대해서 다시금 생각할 수 있는 계기를 마련해주었습니다.
길에 담긴 역사적, 사회적, 문화적, 환경적 의미 등 다양한 방면의 지식을 알게 되어 지혜로워진 것 같은 생각이 듭니다!",2021.12.09
재테크보다 중요한 나만의 재무설계,재테크기초,5점,재테크 기초를 세우는 연수입니다,2021.12.09
온작품 읽기와 그림을 활용한 깊이 있는 수업,온작품 읽기의 매력속으로,5점,"온작품 읽기는 몇년전부터 열풍처럼 교육계를 휩쓸고 있다. 그래서 이러한 온작품 읽기를 통한 교육이 참 궁금했다. 한권의 책을 어떻게 한학기 동안 다룰 수 있는지, 학생들이 과연 흥미를 가지고 참여할지 참 궁금했다. 그래서 이 강의를 들어보았는데 충분이 그럴만한 가치가 있다는 결론이 나왔다. 특히 동시집을 통해 교육과정과 연계한 부분이 가장 인상깊고 꼭 적용해 봐야 겠다는 생각을 해 보았다.",2021.12.09
재테크보다 중요한 나만의 재무설계,정말 기초 지식이 필요한 분들을 위한 연수,5점,재테크의 1도 모르는 사람인지라 기초 지식부터 차근차근 알 수 있는 연수였습니다. 특히 경제 용어를 하나씩 설명해주는 부분이 있어서 좋았습니다. 그리고 실제 사례와 질문을 바탕으로 설명을 진행해주는 방법도 좋았습니다.,2021.12.09
스토리텔링을 활용한 초등수학 수업,이론과 적용을 동시에~,5점,수업장면을 보여줘서 더 적용하기 쉬운거 같아요~,2021.12.09
초등 저학년 남학생 탐구생활,초등 저학년 남학생 탐구생활,5점,"실제 사례를 통해 강의가 진행되어 무척 공감되었습니다.
학생들을 지도하는 데에 많은 도움이 된 강의였습니다.",2021.12.09
지리와 함께하는 인문학 티타임,지리와 함께하는 인문학 티타임,5점,지리와 함께하는 인문학 티타임~ 기대 많이 되는 연수입니다. 연수 후 또 연수 후기를 달아야 겠어요~^*^,2021.12.09
세상에서 제일 쉬운 과학 이야기,세상에서 제일 쉬운 과학 이야기,5점,세상에서 제일 쉬운 과학 이야기~ 기대 많이 되는 연수입니다. 연수 후 또 연수 후기를 달아야 겠어요~^*^,2021.12.09
기초영어 회화 핵심표현 Real Speaking 1,기초영어 회화 핵심표현 Real Speaking 1,5점,기초영어 회화 핵심표현 Real Speaking 1 은 정말 적재적소에 맞는 상황에서 콕 찝어 응용할 수 있는 핵심표현만을 담은 재미있는 연수였습니다.~ 기초영어 회화 핵심표현 Real Speaking 2도 도전하여 공부해 보려구요. 감사합니다.^*^,2021.12.09
옆반 쌤이 알려주는 꿀팁(온라인 수업편),옆반 쌤이 알려주는 꿀팁(온라인 수업편),5점,"웬만한 연수는 적극적으로 재미있게 참여하는 편인데 저는 컴퓨터, 정보기기를 다루는 연수는 별 흥미를 못 느끼는거 같아요. 거르나 옆반 쌤이 알려주는 꿀팁(온라인 수업편)은 많이 부족한 저에게 큰 도움이 되었습니다. 감사합니다.~^*^",2021.12.09
손그림과 파워포인트로 교실 속 콘텐츠 만들기,쉽게 따라할 수 있어요,5점,"온라인 수업때 써보려고
연수를 신청했는데
쉽게쉽게 따라할 수 있어 좋았어요",2021.12.09
쉽게 배우고 활용하는 교실 속 손그림 그리기,쉽게 배우고 활용하는 교실 속 손그림 그리기,5점,"연수의 재료도 무료로 챙겨주셔서 정말 재미있고 즐거운 연수였습니다. 요즘 컬러링(색칠하기)으로 잡념을 버리고 색칠하기에 집중하다보면 힐링이 된다고 하던데, 저한테는 이 연수 자체가 힐링이었습니다. 감사합니다.~^*^",2021.12.09
세상에서 제일 쉬운 과학 이야기,저한테는 굉장히 재밌는 연수였습니다.,5점,"과학에 대한 호기심은 있지만 막연한 어려움이 있었는데, 이 강의를 들으며 많은 궁금증이 해결되고 지식을 쌓게 되었습니다. 그래서 저한테는 굉장히 재밌는 연수였습니다. 이해가 잘 안되는 부분은 2~3회씩 반복해 보면서 제 지적 호기심을 충족하는 시간이었습니다. 좋은 연수 준비해주셔서 고맙습니다.^^",2021.12.09
기후변화 이야기,기후변화에 대해 쉽게 알 수 있었어요,5점,"강의 중간에 말씀하신대로 최대한 쉽게 기후변화에 대해서 설명해주셔서, 막연하게 알고 있던 개념이 조금 더 명확해졌습니다. 연수를 다 듣고 나서 기후위기를 막기 위하여 학급 운영을 하면서 적용해야 할 점들을 고민하게 되었습니다.",2021.12.09
"[고1, 고2 입시전략 특강] 대학진학은 전략싸움이다!",고등학교 학부모라면 필히 받아야할 연수,5점,"고1,고2 학부모들이 반드시 들어야 할 필수적인 내용이 총 망라한 좋은 연수였습니다. 마침 우리 애가 고2라서 같이 들었는데 도움이 많이 되었다고 합니다. 감사합니다~",2021.12.09
"하루 20분, 컬쳐 리스닝 픽업","하루 20분, 컬쳐 리스닝 픽업",5점,"영어 연수를 개인적으로 좋아하지만, 리스닝은 매번 어렵더군요. 하루 20분, 컬쳐 리스닝 픽업 연수 덕분에 제 영어 실력도 조금은 정진한 것 같아요~ 감사합니다.^*^",2021.12.08
"하루 20분, 상황별 생활영어회화","하루 20분, 상황별 생활영어회화",5점,"하루 20분은 짧으면 짧다고 생각되지만, 그러나 시간이 없다는 핑계보다는 시간과 짬을 내어 좋아하는 영어 연수 연습을 하게 되었습니다. 재미있는 연수 잘 받았습니다. 감사합니다.~^*^",2021.12.08
메디컬 콘서트 2탄 - 여성 건강 프로젝트,메디컬 콘서트 2탄- 여성 건강 프로젝트,5점,건강은 항상 걱정이 되고 고민이 됩니다. 메디컬 콘서트 2탄 - 여성 건강 프로젝트 연수를 통해 건강에 대한 궁금증을 가깝게 여기면서 쉽게 해결할 수 있었습니다. 감사합니다.~^*^,2021.12.08
'척' 하면 '딱' 붙는 대입 진학지도,척 하면 딱 붙는 대입 진학지도,5점,"아들이 내년 2023년에 고3이 되어 많은 궁금증과 걱정으로 연수를 신청했었는데, 많은 도움을 얻었습니다. 감사합니다.~^*^",2021.12.08
재테크보다 중요한 나만의 재무설계,실제적으로 도움되는 내용은 별로 없어 아쉬웠습니다.,2점,전반적으로 당연하고 좋은(?) 말씀이었지만 실제로 도움이 될만한 강의는 아니라 아쉬웠습니다. 더군다나 유료연수였다는 점을 생각하면 좀 돈과 시간이 아까웠어요..,2021.12.08
"김준우의 톡(Talk)톡(Talk)한국사, 한국사능력검정시험-전근대사",초등학생에게도 바로 적용되는 연수,5점,5학년을 맡으면서 2학기 사회 과목 내용이 한국사로 이루어져 있어서 나름 역사에 자신있다고 생각하고 학생들을 가르쳤지만 요즘 학생들이 역사 수준이 저 때보다는 훨씬 높아진걸 모르고 수업시간에 질문에 제대로 대답하지 못하고 당황했었는데 마침 이 한국사 연수가 있는 걸 알고 지푸라기라도 잡는 심정으로 수강을 했는데 바로 초등학생을 대상으로 그대로 교육을 진행해도 될 정도로 내용이 알차서 좋았고 덕분에 저도 역사의 흐름이 얼마나 중요한 것인가를 깨닫게 되는 아주 소중한 계기가 되었습니다. 역사를 가르치고자 하는 선생님들에게 이 연수를 강추합니다,2021.12.08
"하루 20분, 컬쳐 리스닝 픽업",재밌게 잘 들었습니다.,5점,"원어민 선생님이 소개하는 우리 문화!!

색다른 연수에 눈길이 갔어요

재미있게 잘 들었습니다~",2021.12.08
"하루 20분, 상황별 생활영어회화",짬짬이 듣기에 아주 좋은 연수네요~,5점,짧은 시간 시간 이용해서 유익하게 잘 들었습니다.,2021.12.08
한 번에 끝내는 법정연수 1,한 번에 끝내서 좋았습니다.,5점,학년말 바쁜 시기에 한 번에 끝낼 수 있어서 좋았습니다.,2021.12.08
교사를 위한 교실 밖 여행인문학,우리나라의 숨겨진 아름다움!,5점,우리나라는 참 아름답다. 이렇게 아름다운 우리나라를 여행하면 보통은 잘 알고 있는 서울이나 제주도만 떠올렸다. 그리고 수업시간에 다루는 지역 역시 유명한 지역에 국한되었는데 이번 강의를 들으며 우리나라 이곳 저곳의 숨겨진 장소도 알게 되고 그 지역만의 특징도 알게 되어 개인적으로도 만족스러웠고 교사로서도 학생들에게 더 생생하고 구체적으로 가르칠 수 있어서 좋았던 연수였다. 이번 연수를 들으며 가장 많이 들었던 생각이 바로 여행을 가고 싶다는 것이다. 이번 방학때는 이번 연수를 통해 알게된 지역을 여행해 봐야 겠다.,2021.12.08
"나이와 신분을 초월한 독립운동, 그 현장을 읽다",근대사를 다시 공부할 수 있는 좋은 기회,5점,전국 각지에서 수많은 의병활동이 있었다는 것을 알게되었다. 지금까지 알던 의병활동 등은 매우 적은 일부였고 앞으로 많은 공부가 필요하다고 느끼게 되었다.,2021.12.08
쉽게 배우고 활용하는 교실 속 손그림 그리기,그림은 초등교육에서 최고의 수업도구!,5점,"아이패드를 가지고 있기도 했고, 평소에 그림 끄적이는 걸 좋아했습니다.
요즘 귀여운 굿즈 보면, 정말 나도 그리겠다 싶은 귀여운 굿즈들도 인기잖아요~(제 취향이기도 합니다.)
제가 좋아하는 것이다보니 배워보고 싶고, 또 이걸 교육에 사용하면 더욱 시너지 효과가 날 것 같아 연수를 신청했었습니다. 정말 좋았던건, 겉돌기식의 연수가 아닌 정말 실질적인 도움이 되는 프로그램 소개부터 그림의 기초인 점, 선, 면, 도형부터 시작되는 점이 좋더라구요.
덕분에 아이패드를 수업시간에 더 잘 활용할 수 있을 것 같습니다. 돈이 안아까웠던 연수였어요!!",2021.12.08
수업을 살리는 체육 레시피,체육 수업에 자신감이 생겨요~,5점,"체육수업에 자신이 없는 선생님들이여~~

이 연수를 들으라!!

많은 도움이 될 지니...^^",2021.12.08
수업을 살리는 놀이 레시피,수업에 적용할 수 있는 다양한 놀이 종합 선물 세트,5점,"수업을 더욱 즐겁게 만들어주는 좋은 아이템을 얻을 수 있었습니다!!

좋은 연수 감사합니다!!",2021.12.08
기후변화 이야기,기후변화,5점,지구온난화에 관심은 있었지만 자세히 공부해 볼 기회가 많이 없었는데 이번에 여러모로 좋은 기회였습니다~,2021.12.08
초등 저학년 남학생 탐구생활,저학년 남학생,5점,저학년 남학생에 대해 좀 더 깊이 이해할 수 있는 시간이었어요~,2021.12.08
시간을 걷는 인문학,인문학,5점,새로운 관점에서 다양한 인문학 소양을 갖출 수 있는 기회였어요~,2021.12.08
문학 속 지리 이야기,새로운 이야기,5점,문학 작품 속에 담겨진 지리에 대해 더욱 잘 알게 되었어요~,2021.12.08
교사 자존감 수업,자존감,5점,자존감에 대해 다시 한 번 생각해보고 나와 아이들의 자존감을 고취시키도록 더욱 노력하게 되었어요~,2021.12.08
교과수업에 활용하는 진로교육,진로교육,5점,내실있는 진로교육에 도움이 되었어요~,2021.12.08
손그림과 파워포인트로 교실 속 콘텐츠 만들기,앞으로 잘 활용할 것 같습니다.,5점,학교에서 이미지의 유용성을 많이 느끼고 있습니다. 이 연수를 잘 활용한다면 교실 속 배움 활동이 더욱 즐겁고 알찰 것 같습니다.,2021.12.07
